<mon:moneyTransfer xmlns:mon="http://www.simplex-software.fr/money-transfer"
                   xmlns:xsi="http://www.w3.org/2001/XMLSchema-instance"
                   xsi:schemaLocation="http://www.simplex-software.fr/money-transfer ../xsd/money-transfer.xsd">
  <mon:reference>Tech Repairs</mon:reference>
  <mon:sourceAccount accountID="SG01" accountType="CHECKING" sortCode="04004" accountNumber="00050525712" transCode="03000">
    <mon:bank bankName="Société Générale">
      <mon:bankAddresses streetName="av. de Paris" streetNumber="18" poBox="Cedex" cityName="Montmorency" zipCode="95800" countryName="France"/>
    </mon:bank>
  </mon:sourceAccount>
  <mon:targetAccount accountID="ING01" accountType="SAVINGS" sortCode="08080" accountNumber="425091789" transCode="7BRE0">
    <mon:bank bankName="ING">
      <mon:bankAddresses streetName="blvd. Waterloo" streetNumber="381" poBox="INGPOBOX" cityName="Waterloo" zipCode="B1000" countryName="Belgium"/>
    </mon:bank>
  </mon:targetAccount>
  <mon:amount>1000.00</mon:amount>
</mon:moneyTransfer>
